{
  "$schema": "https://json-schema.org/draft/2020-12/schema",
  "$id": "https://homelab.local/schemas/payloads/polar/polar.offline.gyro.v1-draft.schema.json",
  "title": "polar.offline.gyro v1-draft",
  "type": "object",
  "additionalProperties": false,
  "required": [
    "recording",
    "units",
    "channels",
    "samples"
  ],
  "properties": {
    "recording": {
      "type": "object",
      "additionalProperties": false,
      "required": [
        "type",
        "source"
      ],
      "properties": {
        "type": {
          "type": "string",
          "const": "GYRO"
        },
        "source": {
          "type": "string",
          "const": "polar_verity_sense_offline"
        }
      }
    },
    "units": {
      "type": "object",
      "additionalProperties": false,
      "required": [
        "raw_timestamp_ns",
        "x_dps",
        "y_dps",
        "z_dps"
      ],
      "properties": {
        "raw_timestamp_ns": {
          "type": "string",
          "const": "ns"
        },
        "x_dps": {
          "type": "string",
          "const": "deg/sec"
        },
        "y_dps": {
          "type": "string",
          "const": "deg/sec"
        },
        "z_dps": {
          "type": "string",
          "const": "deg/sec"
        }
      }
    },
    "channels": {
      "type": "array",
      "items": {
        "type": "string",
        "enum": [
          "x_dps",
          "y_dps",
          "z_dps"
        ]
      },
      "minItems": 3,
      "maxItems": 3,
      "uniqueItems": true
    },
    "samples": {
      "type": "array",
      "minItems": 1,
      "items": {
        "type": "object",
        "additionalProperties": false,
        "required": [
          "sample_index",
          "raw_timestamp_ns",
          "x_dps",
          "y_dps",
          "z_dps"
        ],
        "properties": {
          "sample_index": {
            "type": "integer",
            "minimum": 0
          },
          "raw_timestamp_ns": {
            "type": "integer",
            "minimum": 0
          },
          "x_dps": {
            "type": "number"
          },
          "y_dps": {
            "type": "number"
          },
          "z_dps": {
            "type": "number"
          }
        }
      }
    }
  }
}
