{
  "recording": {
    "type": "GYRO",
    "source": "polar_verity_sense_offline"
  },
  "units": {
    "raw_timestamp_ns": "ns",
    "x_dps": "deg/sec",
    "y_dps": "deg/sec",
    "z_dps": "deg/sec"
  },
  "channels": [
    "x_dps",
    "y_dps",
    "z_dps"
  ],
  "samples": [
    {
      "sample_index": 0,
      "raw_timestamp_ns": 545998017227188608,
      "x_dps": 1.42,
      "y_dps": -0.31,
      "z_dps": 0.08
    },
    {
      "sample_index": 1,
      "raw_timestamp_ns": 545998017229688608,
      "x_dps": 1.39,
      "y_dps": -0.29,
      "z_dps": 0.09
    }
  ]
}
